{"buildingId":"plain-residential-poor-3x4x4f","coreFrame":{"anglesDeg":[90,0]},"bounds":{"footprint":[[0,0],[24,0],[24,32],[0,32]],"height":19.9},"facade":{"surfacePattern":{"kind":"continuous"},"groundMaterial":{"key":"cyberpunk/concrete-monolith/poor","variantId":"native-cast"},"exteriorStyle":"residential-salvaged","style":"megablock","panelModule":2,"panelPattern":{"width":2,"height":1,"jointWidth":0.02,"origin":"face-floor","boundary":"centered-solid-border"},"materialPlan":{"palette":"neutral-dystopian","field":{"key":"cyberpunk/concrete-monolith/poor","variantId":"native-cast"},"border":{"key":"cyberpunk/concrete-monolith/poor","variantId":"native-cast"},"trim":{"key":"cyberpunk/wall-trim/poor","variantId":"paint"}},"wallDepth":0.48,"coreAdjacency":{"glazing":{"role":"circulation","clearDepth":1.2}},"slabBand":{"below":0.5,"above":0},"grids":[{"floor":0,"edge":0,"length":24,"panelWidth":2,"panelHeight":1,"horizontal":[0,2,4,6,8,10,12,14,16,18,20,22,24],"vertical":[0,0.25,1.25,2.25,3.25,4.25,5.25,5.5],"horizontalBorders":[0,0],"verticalBorders":[0.25,0.25],"solid":[[0,8.387],[14.613,24]],"partitionAnchors":[{"offset":4.1935,"width":8.387},{"offset":19.3065,"width":9.387}]},{"floor":0,"edge":1,"length":32,"panelWidth":2,"panelHeight":1,"horizontal":[0,2,4,6,8,10,12,14,16,18,20,22,24,26,28,30,32],"vertical":[0,0.25,1.25,2.25,3.25,4.25,5.25,5.5],"horizontalBorders":[0,0],"verticalBorders":[0.25,0.25],"solid":[[0,5],[7,12],[14,18],[20,25],[27,32]],"partitionAnchors":[{"offset":2.5,"width":5},{"offset":9.5,"width":5},{"offset":16,"width":4},{"offset":22.5,"width":5},{"offset":29.5,"width":5}]},{"floor":0,"edge":2,"length":24,"panelWidth":2,"panelHeight":1,"horizontal":[0,2,4,6,8,10,12,14,16,18,20,22,24],"vertical":[0,0.25,1.25,2.25,3.25,4.25,5.25,5.5],"horizontalBorders":[0,0],"verticalBorders":[0.25,0.25],"solid":[[0,1],[3,8],[10,14],[16,21],[23,24]],"partitionAnchors":[{"offset":0.5,"width":1},{"offset":5.5,"width":5},{"offset":12,"width":4},{"offset":18.5,"width":5},{"offset":23.5,"width":1}]},{"floor":0,"edge":3,"length":32,"panelWidth":2,"panelHeight":1,"horizontal":[0,2,4,6,8,10,12,14,16,18,20,22,24,26,28,30,32],"vertical":[0,0.25,1.25,2.25,3.25,4.25,5.25,5.5],"horizontalBorders":[0,0],"verticalBorders":[0.25,0.25],"solid":[[0,5],[7,12],[14,18],[20,25],[27,32]],"partitionAnchors":[{"offset":2.5,"width":5},{"offset":9.5,"width":5},{"offset":16,"width":4},{"offset":22.5,"width":5},{"offset":29.5,"width":5}]},{"floor":1,"edge":0,"length":24,"panelWidth":2,"panelHeight":1,"horizontal":[0,2,4,6,8,10,12,14,16,18,20,22,24],"vertical":[0,0.25,1.25,2.25,3.25,4.25,4.5],"horizontalBorders":[0,0],"verticalBorders":[0.25,0.25],"solid":[[0,4],[7.5,8],[11.5,12],[15.5,16],[19.5,24]],"partitionAnchors":[{"offset":2,"width":4},{"offset":7.75,"width":0.5},{"offset":11.75,"width":0.5},{"offset":15.75,"width":0.5},{"offset":21.75,"width":4.5}]},{"floor":1,"edge":1,"length":32,"panelWidth":2,"panelHeight":1,"horizontal":[0,2,4,6,8,10,12,14,16,18,20,22,24,26,28,30,32],"vertical":[0,0.25,1.25,2.25,3.25,4.25,4.5],"horizontalBorders":[0,0],"verticalBorders":[0.25,0.25],"solid":[[0,4],[7.5,9],[11,12],[15.5,16],[19.5,20],[23.5,25],[27,32]],"partitionAnchors":[{"offset":2,"width":4},{"offset":8.25,"width":1.5},{"offset":11.5,"width":1},{"offset":15.75,"width":0.5},{"offset":19.75,"width":0.5},{"offset":24.25,"width":1.5},{"offset":29.5,"width":5}]},{"floor":1,"edge":2,"length":24,"panelWidth":2,"panelHeight":1,"horizontal":[0,2,4,6,8,10,12,14,16,18,20,22,24],"vertical":[0,0.25,1.25,2.25,3.25,4.25,4.5],"horizontalBorders":[0,0],"verticalBorders":[0.25,0.25],"solid":[[0,5],[7,9],[11,12],[15.5,16],[19.5,24]],"partitionAnchors":[{"offset":2.5,"width":5},{"offset":8,"width":2},{"offset":11.5,"width":1},{"offset":15.75,"width":0.5},{"offset":21.75,"width":4.5}]},{"floor":1,"edge":3,"length":32,"panelWidth":2,"panelHeight":1,"horizontal":[0,2,4,6,8,10,12,14,16,18,20,22,24,26,28,30,32],"vertical":[0,0.25,1.25,2.25,3.25,4.25,4.5],"horizontalBorders":[0,0],"verticalBorders":[0.25,0.25],"solid":[[0,4],[7.5,8],[11.5,12],[15.5,16],[19.5,20],[23.5,24],[27.5,32]],"partitionAnchors":[{"offset":2,"width":4},{"offset":7.75,"width":0.5},{"offset":11.75,"width":0.5},{"offset":15.75,"width":0.5},{"offset":19.75,"width":0.5},{"offset":23.75,"width":0.5},{"offset":29.75,"width":4.5}]},{"floor":2,"edge":0,"length":24,"panelWidth":2,"panelHeight":1,"horizontal":[0,2,4,6,8,10,12,14,16,18,20,22,24],"vertical":[0,0.25,1.25,2.25,3.25,4.25,4.5],"horizontalBorders":[0,0],"verticalBorders":[0.25,0.25],"solid":[[0,4],[7.5,8],[11.5,12],[15.5,16],[19.5,24]],"partitionAnchors":[{"offset":2,"width":4},{"offset":7.75,"width":0.5},{"offset":11.75,"width":0.5},{"offset":15.75,"width":0.5},{"offset":21.75,"width":4.5}]},{"floor":2,"edge":1,"length":32,"panelWidth":2,"panelHeight":1,"horizontal":[0,2,4,6,8,10,12,14,16,18,20,22,24,26,28,30,32],"vertical":[0,0.25,1.25,2.25,3.25,4.25,4.5],"horizontalBorders":[0,0],"verticalBorders":[0.25,0.25],"solid":[[0,4],[7.5,9],[11,12],[15.5,20],[23.5,25],[27,32]],"partitionAnchors":[{"offset":2,"width":4},{"offset":8.25,"width":1.5},{"offset":11.5,"width":1},{"offset":17.75,"width":4.5},{"offset":24.25,"width":1.5},{"offset":29.5,"width":5}]},{"floor":2,"edge":2,"length":24,"panelWidth":2,"panelHeight":1,"horizontal":[0,2,4,6,8,10,12,14,16,18,20,22,24],"vertical":[0,0.25,1.25,2.25,3.25,4.25,4.5],"horizontalBorders":[0,0],"verticalBorders":[0.25,0.25],"solid":[[0,5],[7,9],[11,12],[15.5,16],[19.5,24]],"partitionAnchors":[{"offset":2.5,"width":5},{"offset":8,"width":2},{"offset":11.5,"width":1},{"offset":15.75,"width":0.5},{"offset":21.75,"width":4.5}]},{"floor":2,"edge":3,"length":32,"panelWidth":2,"panelHeight":1,"horizontal":[0,2,4,6,8,10,12,14,16,18,20,22,24,26,28,30,32],"vertical":[0,0.25,1.25,2.25,3.25,4.25,4.5],"horizontalBorders":[0,0],"verticalBorders":[0.25,0.25],"solid":[[0,8],[11.5,12],[15.5,16],[19.5,20],[23.5,24],[27.5,32]],"partitionAnchors":[{"offset":4,"width":8},{"offset":11.75,"width":0.5},{"offset":15.75,"width":0.5},{"offset":19.75,"width":0.5},{"offset":23.75,"width":0.5},{"offset":29.75,"width":4.5}]},{"floor":3,"edge":0,"length":24,"panelWidth":2,"panelHeight":1,"horizontal":[0,2,4,6,8,10,12,14,16,18,20,22,24],"vertical":[0,0.25,1.25,2.25,3.25,4.25,4.5],"horizontalBorders":[0,0],"verticalBorders":[0.25,0.25],"solid":[[0,4],[7.5,8],[11.5,12],[15.5,16],[19.5,24]],"partitionAnchors":[{"offset":2,"width":4},{"offset":7.75,"width":0.5},{"offset":11.75,"width":0.5},{"offset":15.75,"width":0.5},{"offset":21.75,"width":4.5}]},{"floor":3,"edge":1,"length":32,"panelWidth":2,"panelHeight":1,"horizontal":[0,2,4,6,8,10,12,14,16,18,20,22,24,26,28,30,32],"vertical":[0,0.25,1.25,2.25,3.25,4.25,4.5],"horizontalBorders":[0,0],"verticalBorders":[0.25,0.25],"solid":[[0,4],[7.5,9],[11,12],[15.5,20],[23.5,25],[27,32]],"partitionAnchors":[{"offset":2,"width":4},{"offset":8.25,"width":1.5},{"offset":11.5,"width":1},{"offset":17.75,"width":4.5},{"offset":24.25,"width":1.5},{"offset":29.5,"width":5}]},{"floor":3,"edge":2,"length":24,"panelWidth":2,"panelHeight":1,"horizontal":[0,2,4,6,8,10,12,14,16,18,20,22,24],"vertical":[0,0.25,1.25,2.25,3.25,4.25,4.5],"horizontalBorders":[0,0],"verticalBorders":[0.25,0.25],"solid":[[0,5],[7,9],[11,12],[15.5,16],[19.5,24]],"partitionAnchors":[{"offset":2.5,"width":5},{"offset":8,"width":2},{"offset":11.5,"width":1},{"offset":15.75,"width":0.5},{"offset":21.75,"width":4.5}]},{"floor":3,"edge":3,"length":32,"panelWidth":2,"panelHeight":1,"horizontal":[0,2,4,6,8,10,12,14,16,18,20,22,24,26,28,30,32],"vertical":[0,0.25,1.25,2.25,3.25,4.25,4.5],"horizontalBorders":[0,0],"verticalBorders":[0.25,0.25],"solid":[[0,4],[7.5,8],[11.5,12],[15.5,16],[19.5,20],[23.5,24],[27.5,32]],"partitionAnchors":[{"offset":2,"width":4},{"offset":7.75,"width":0.5},{"offset":11.75,"width":0.5},{"offset":15.75,"width":0.5},{"offset":19.75,"width":0.5},{"offset":23.75,"width":0.5},{"offset":29.75,"width":4.5}]}]},"roof":{"elevation":19,"outline":[[0,0],[24,0],[24,32],[0,32]],"parapetHeight":0.9,"bulkhead":{"center":[14.999999999999998,18.25],"axis":[6.123233995736766e-17,-1],"width":7.5,"depth":4,"housingHeight":2.6,"doorNormal":[6.123233995736766e-17,-1],"doorWidth":1,"doorHeight":2.1},"artifacts":[{"id":"roof-artifact:water-tank:0","kind":"water-tank","center":[10.85,5.5],"size":[3.7,3.15,4.05],"rotationDeg":90},{"id":"roof-artifact:hvac:1","kind":"hvac","center":[19.05,21.95],"size":[1.25,0.6,0.9],"rotationDeg":90}],"material":{"key":"cyberpunk/roof/poor","variantId":"plain"}},"floors":[{"index":0,"kind":"entry","elevation":0,"height":5.5,"outline":[[0,0],[24,0],[24,32],[0,32]],"roomEnvelope":{"corners":[[0.5,0.5],[23.5,0.5],[23.5,31.5],[0.5,31.5]],"origin":[0.5,0.5],"axisU":[1,0],"axisV":[0,1],"width":23,"depth":31,"grid":{"origin":[0,0],"angle":0,"spacing":0.5},"vertical":{"min":0,"max":5}},"openings":[{"id":"entrance","kind":"door","doorRole":"main","edge":0,"offset":10,"width":3,"height":3,"sill":0,"leaves":2,"door":{"set":"layered","frameWidth":0.259,"frameDepth":0.07,"recessDepth":0.16,"thresholdHeight":0,"motion":{"kind":"pocket","maxTravel":1.55,"clearDepth":0,"leaves":[{"leaf":0,"travelU":-1.55,"pocket":{"offset":8.422,"sill":0.002,"width":1.578,"height":3.026,"frontDepth":0.127,"backDepth":0.223}},{"leaf":1,"travelU":1.55,"pocket":{"offset":13,"sill":0.002,"width":1.578,"height":3.026,"frontDepth":0.127,"backDepth":0.223}}]},"clearance":{"offset":10,"sill":0,"width":3,"height":3,"backDepth":0.258},"cassette":{"offset":8.387,"sill":0,"width":6.226,"height":3.259,"backDepth":0.258}},"material":"cyberpunk/door/poor"},{"id":"w:0:1:0","kind":"window","edge":1,"offset":12,"width":2,"height":4,"sill":0.5,"state":"closed","curtain":{"style":"roller-shade","closurePercent":100},"panes":{"cols":1,"rows":1},"material":"cyberpunk/window-glass/poor","windowTreatment":{"privacy":"shell-only","nodeId":"ground-privacy:w:0:1:0"},"glazing":{"offset":12,"sill":0.5,"width":2,"height":4,"glassDepth":0.38999999999999996,"housingBackDepth":0.48}}